[
  {
    "id": "zeokeel/admin-ui-kit",
    "version": "0.1.0",
    "kind": "ui",
    "roles": [
      "admin.kit"
    ]
  },
  {
    "id": "zeokeel/admin-apps",
    "version": "0.1.0",
    "kind": "ui",
    "roles": [
      "admin.page.apps"
    ]
  },
  {
    "id": "zeokeel/admin-audit",
    "version": "0.1.0",
    "kind": "ui",
    "roles": [
      "admin.page.audit"
    ]
  },
  {
    "id": "zeokeel/admin-connectors",
    "version": "0.1.0",
    "kind": "ui",
    "roles": [
      "admin.page.connectors"
    ]
  },
  {
    "id": "zeokeel/admin-jobs",
    "version": "0.1.0",
    "kind": "ui",
    "roles": [
      "admin.page.jobs"
    ]
  },
  {
    "id": "zeokeel/admin-pricing",
    "version": "0.1.0",
    "kind": "ui",
    "roles": [
      "admin.page.pricing"
    ]
  },
  {
    "id": "zeokeel/admin-settings",
    "version": "0.1.0",
    "kind": "ui",
    "roles": [
      "admin.page.settings"
    ]
  },
  {
    "id": "zeokeel/admin-skills",
    "version": "0.1.0",
    "kind": "ui",
    "roles": [
      "admin.page.skills"
    ]
  },
  {
    "id": "zeokeel/admin-usage",
    "version": "0.1.0",
    "kind": "ui",
    "roles": [
      "admin.page.usage"
    ]
  },
  {
    "id": "zeokeel/admin-users",
    "version": "0.1.0",
    "kind": "ui",
    "roles": [
      "admin.page.users"
    ]
  },
  {
    "id": "zeokeel/admin-wallet",
    "version": "0.1.0",
    "kind": "ui",
    "roles": [
      "admin.page.wallet"
    ]
  },
  {
    "id": "zeokeel/admin-shell",
    "version": "0.1.0",
    "kind": "ui",
    "roles": [
      "admin.shell"
    ]
  },
  {
    "id": "zeokeel/agent-loop",
    "version": "0.1.0",
    "kind": "capability",
    "roles": [
      "agent.loop"
    ]
  },
  {
    "id": "zeokeel/client-auth",
    "version": "0.1.0",
    "kind": "capability",
    "roles": [
      "auth.client"
    ]
  },
  {
    "id": "zeokeel/llm-gateway",
    "version": "0.1.0",
    "kind": "capability",
    "roles": [
      "llm.provider.default"
    ]
  },
  {
    "id": "zeokeel/app-db",
    "version": "0.1.0",
    "kind": "capability",
    "roles": [
      "srv.app.db"
    ]
  },
  {
    "id": "zeokeel/app-runtime",
    "version": "0.1.0",
    "kind": "capability",
    "roles": [
      "srv.app.runtime"
    ]
  },
  {
    "id": "zeokeel/apps",
    "version": "0.1.0",
    "kind": "capability",
    "roles": [
      "srv.apps"
    ]
  },
  {
    "id": "zeokeel/audit",
    "version": "0.1.0",
    "kind": "service",
    "roles": [
      "srv.audit"
    ]
  },
  {
    "id": "zeokeel/auth",
    "version": "0.1.0",
    "kind": "service",
    "roles": [
      "srv.auth.session"
    ]
  },
  {
    "id": "zeokeel/connectors",
    "version": "0.1.0",
    "kind": "capability",
    "roles": [
      "srv.connectors"
    ]
  },
  {
    "id": "zeokeel/content",
    "version": "0.1.0",
    "kind": "capability",
    "roles": [
      "srv.content"
    ]
  },
  {
    "id": "zeokeel/gateway",
    "version": "0.1.0",
    "kind": "service",
    "roles": [
      "srv.gateway"
    ]
  },
  {
    "id": "zeokeel/srv-http",
    "version": "0.1.0",
    "kind": "service",
    "roles": [
      "srv.http"
    ]
  },
  {
    "id": "zeokeel/jobs",
    "version": "0.1.0",
    "kind": "service",
    "roles": [
      "srv.jobs"
    ]
  },
  {
    "id": "zeokeel/pricing",
    "version": "0.1.0",
    "kind": "service",
    "roles": [
      "srv.pricing"
    ]
  },
  {
    "id": "zeokeel/settings",
    "version": "0.1.0",
    "kind": "service",
    "roles": [
      "srv.settings"
    ]
  },
  {
    "id": "zeokeel/skills",
    "version": "0.1.0",
    "kind": "capability",
    "roles": [
      "srv.skills"
    ]
  },
  {
    "id": "zeokeel/updates",
    "version": "0.1.0",
    "kind": "capability",
    "roles": [
      "srv.updates"
    ]
  },
  {
    "id": "zeokeel/users",
    "version": "0.1.0",
    "kind": "service",
    "roles": [
      "srv.users"
    ]
  },
  {
    "id": "zeokeel/wallet",
    "version": "0.1.0",
    "kind": "service",
    "roles": [
      "srv.wallet"
    ]
  },
  {
    "id": "zeokeel/store-session-sqlite",
    "version": "0.1.0",
    "kind": "capability",
    "roles": [
      "store.session"
    ]
  },
  {
    "id": "zeokeel/store-settings-json",
    "version": "0.1.0",
    "kind": "capability",
    "roles": [
      "store.settings"
    ]
  },
  {
    "id": "zeokeel/tool-agent-team",
    "version": "0.1.0",
    "kind": "capability",
    "roles": [
      "tool.agent_team"
    ]
  },
  {
    "id": "zeokeel/tool-ask-user",
    "version": "0.1.0",
    "kind": "capability",
    "roles": [
      "tool.ask_user"
    ]
  },
  {
    "id": "zeokeel/tool-bash",
    "version": "0.1.0",
    "kind": "capability",
    "roles": [
      "tool.bash"
    ]
  },
  {
    "id": "zeokeel/tool-bash-persistent",
    "version": "0.1.0",
    "kind": "capability",
    "roles": [
      "tool.bash_persistent"
    ]
  },
  {
    "id": "zeokeel/tool-cordis",
    "version": "0.1.0",
    "kind": "capability",
    "roles": [
      "tool.cordis"
    ]
  },
  {
    "id": "zeokeel/tool-extract",
    "version": "0.1.0",
    "kind": "capability",
    "roles": [
      "tool.extract"
    ]
  },
  {
    "id": "zeokeel/tool-fs",
    "version": "0.1.0",
    "kind": "capability",
    "roles": [
      "tool.fs"
    ]
  },
  {
    "id": "zeokeel/tool-fs-edit",
    "version": "0.1.0",
    "kind": "capability",
    "roles": [
      "tool.fs.edit"
    ]
  },
  {
    "id": "zeokeel/tool-fs-search",
    "version": "0.1.0",
    "kind": "capability",
    "roles": [
      "tool.fs.search"
    ]
  },
  {
    "id": "zeokeel/tool-fs-write",
    "version": "0.1.0",
    "kind": "capability",
    "roles": [
      "tool.fs.write"
    ]
  },
  {
    "id": "zeokeel/tool-glob",
    "version": "0.1.0",
    "kind": "capability",
    "roles": [
      "tool.glob"
    ]
  },
  {
    "id": "zeokeel/tool-goal",
    "version": "0.1.0",
    "kind": "capability",
    "roles": [
      "tool.goal"
    ]
  },
  {
    "id": "zeokeel/tool-grep",
    "version": "0.1.0",
    "kind": "capability",
    "roles": [
      "tool.grep"
    ]
  },
  {
    "id": "zeokeel/tool-job-kill",
    "version": "0.1.0",
    "kind": "capability",
    "roles": [
      "tool.jobs.kill"
    ]
  },
  {
    "id": "zeokeel/tool-job-list",
    "version": "0.1.0",
    "kind": "capability",
    "roles": [
      "tool.jobs.list"
    ]
  },
  {
    "id": "zeokeel/tool-job-output",
    "version": "0.1.0",
    "kind": "capability",
    "roles": [
      "tool.jobs.output"
    ]
  },
  {
    "id": "zeokeel/tool-present",
    "version": "0.1.0",
    "kind": "capability",
    "roles": [
      "tool.present"
    ]
  },
  {
    "id": "zeokeel/tool-pwsh",
    "version": "0.1.0",
    "kind": "capability",
    "roles": [
      "tool.pwsh"
    ]
  },
  {
    "id": "zeokeel/tool-pwsh-persistent",
    "version": "0.1.0",
    "kind": "capability",
    "roles": [
      "tool.pwsh_persistent"
    ]
  },
  {
    "id": "zeokeel/tool-ralph",
    "version": "0.1.0",
    "kind": "capability",
    "roles": [
      "tool.ralph"
    ]
  },
  {
    "id": "zeokeel/tool-read-document",
    "version": "0.1.0",
    "kind": "capability",
    "roles": [
      "tool.read_document"
    ]
  },
  {
    "id": "zeokeel/tool-read-image",
    "version": "0.1.0",
    "kind": "capability",
    "roles": [
      "tool.read_image"
    ]
  },
  {
    "id": "zeokeel/tool-schedule",
    "version": "0.1.0",
    "kind": "capability",
    "roles": [
      "tool.schedule"
    ]
  },
  {
    "id": "zeokeel/tool-session-query",
    "version": "0.1.0",
    "kind": "capability",
    "roles": [
      "tool.session_query"
    ]
  },
  {
    "id": "zeokeel/tool-skill",
    "version": "0.1.0",
    "kind": "capability",
    "roles": [
      "tool.skill"
    ]
  },
  {
    "id": "zeokeel/tool-subagent",
    "version": "0.1.0",
    "kind": "capability",
    "roles": [
      "tool.subagent"
    ]
  },
  {
    "id": "zeokeel/tool-subagent-control",
    "version": "0.1.0",
    "kind": "capability",
    "roles": [
      "tool.subagent_control"
    ]
  },
  {
    "id": "zeokeel/tool-terminal",
    "version": "0.1.0",
    "kind": "capability",
    "roles": [
      "tool.terminal"
    ]
  },
  {
    "id": "zeokeel/tool-todo",
    "version": "0.1.0",
    "kind": "capability",
    "roles": [
      "tool.todo"
    ]
  },
  {
    "id": "zeokeel/tool-web-fetch",
    "version": "0.1.0",
    "kind": "capability",
    "roles": [
      "tool.web.fetch"
    ]
  },
  {
    "id": "zeokeel/tool-web-search",
    "version": "0.1.0",
    "kind": "capability",
    "roles": [
      "tool.web_search"
    ]
  },
  {
    "id": "zeokeel/tool-workflow",
    "version": "0.1.0",
    "kind": "capability",
    "roles": [
      "tool.workflow"
    ]
  },
  {
    "id": "zeokeel/tool-working-directory",
    "version": "0.1.0",
    "kind": "capability",
    "roles": [
      "tool.working_directory"
    ]
  },
  {
    "id": "zeokeel/tool-workspace-dependencies",
    "version": "0.1.0",
    "kind": "capability",
    "roles": [
      "tool.workspace_dependencies"
    ]
  },
  {
    "id": "zeokeel/tool-worktree",
    "version": "0.1.0",
    "kind": "capability",
    "roles": [
      "tool.worktree"
    ]
  },
  {
    "id": "zeokeel/ui-kit",
    "version": "0.1.0",
    "kind": "ui",
    "roles": [
      "ui.kit"
    ]
  },
  {
    "id": "zeokeel/ui-shell",
    "version": "0.1.0",
    "kind": "ui",
    "roles": [
      "ui.shell"
    ]
  },
  {
    "id": "zeokeel/ui-apps",
    "version": "0.1.0",
    "kind": "ui",
    "roles": [
      "ui.slot.apps"
    ]
  },
  {
    "id": "zeokeel/ui-chat",
    "version": "0.1.0",
    "kind": "ui",
    "roles": [
      "ui.slot.chat"
    ]
  },
  {
    "id": "zeokeel/ui-commands",
    "version": "0.1.0",
    "kind": "ui",
    "roles": [
      "ui.slot.commands"
    ]
  },
  {
    "id": "zeokeel/ui-connectors",
    "version": "0.1.0",
    "kind": "ui",
    "roles": [
      "ui.slot.connectors"
    ]
  },
  {
    "id": "zeokeel/ui-inspector",
    "version": "0.1.0",
    "kind": "ui",
    "roles": [